{
  "name": "fluent",
  "description": "Fluent Design (Windows 11) — open, friendly, efficient. Soft gray base + white cards + blue accents.",
  "mode": "light",
  "colors": {
    "blue": "#005fb8",
    "red": "#c42b1c",
    "green": "#0b6a0b",
    "purple": "#8661c5",
    "orange": "#e67e22",
    "cyan": "#0099bc"
  },
  "labels": {
    "primary": "#1a1a1a",
    "secondary": "#616161",
    "tertiary": "#9e9e9e",
    "quaternary": "#bdbdbd"
  },
  "backgrounds": {
    "primary": "#f0f0f0",
    "secondary": "#ffffff",
    "tertiary": "#fafafa"
  },
  "fills": {
    "primary": "rgba(0, 0, 0, 0.06)",
    "secondary": "rgba(0, 0, 0, 0.04)",
    "tertiary": "rgba(0, 0, 0, 0.03)",
    "quaternary": "rgba(0, 0, 0, 0.02)"
  },
  "radius": {
    "xs": "2px",
    "sm": "4px",
    "md": "7px",
    "lg": "10px",
    "xl": "14px"
  },
  "shadows": {
    "sm": "0 1px 2px rgba(0, 0, 0, 0.06)",
    "md": "0 2px 8px rgba(0, 0, 0, 0.08)",
    "lg": "0 4px 16px rgba(0, 0, 0, 0.10)"
  },
  "typography": {
    "body": "'Plus Jakarta Sans', -apple-system, 'Segoe UI Variable', 'Segoe UI', system-ui, sans-serif",
    "heading": "'Plus Jakarta Sans', -apple-system, 'Segoe UI Variable', 'Segoe UI', system-ui, sans-serif"
  },
  "spatialMetaphor": "card-elevation",
  "focusRing": "#005fb8",
  "componentSizes": {
    "btnHeightSm": "32px",
    "btnHeightMd": "44px",
    "btnHeightLg": "52px",
    "toggleWidth": "48px",
    "toggleHeight": "26px",
    "toggleThumb": "22px"
  }
}
