{
  "name": "glassmorphism",
  "description": "Dark space background + frosted glass surfaces + luminous accents.",
  "mode": "dark",
  "colors": {
    "blue": "#60a5fa",
    "red": "#f87171",
    "green": "#4ade80",
    "purple": "#a78bfa",
    "orange": "#fb923c",
    "cyan": "#22d3ee"
  },
  "labels": {
    "primary": "rgba(255, 255, 255, 0.95)",
    "secondary": "rgba(255, 255, 255, 0.6)",
    "tertiary": "rgba(255, 255, 255, 0.35)",
    "quaternary": "rgba(255, 255, 255, 0.18)"
  },
  "backgrounds": {
    "primary": "#0a0e27",
    "secondary": "rgba(255, 255, 255, 0.05)",
    "tertiary": "rgba(255, 255, 255, 0.03)"
  },
  "fills": {
    "primary": "rgba(255, 255, 255, 0.12)",
    "secondary": "rgba(255, 255, 255, 0.08)",
    "tertiary": "rgba(255, 255, 255, 0.05)",
    "quaternary": "rgba(255, 255, 255, 0.03)"
  },
  "radius": {
    "xs": "4px",
    "sm": "12px",
    "md": "16px",
    "lg": "20px",
    "xl": "24px"
  },
  "shadows": {
    "sm": "0 1px 2px rgba(0, 0, 0, 0.3)",
    "md": "0 4px 12px rgba(0, 0, 0, 0.4), 0 1px 3px rgba(0, 0, 0, 0.2)",
    "lg": "0 8px 32px rgba(0, 0, 0, 0.5), 0 2px 6px rgba(0, 0, 0, 0.2)"
  },
  "typography": {
    "body": "'Plus Jakarta Sans', -apple-system, system-ui, sans-serif",
    "heading": "'Playfair Display', Georgia, 'Times New Roman', serif"
  },
  "spatialMetaphor": "ambient-glow",
  "focusRing": "rgba(96, 165, 250, 0.6)"
}
