{
  "name": "modern-neutral",
  "description": "Clean, generic, platform-agnostic. Blue accent on neutral gray skeleton.",
  "mode": "light",
  "colors": {
    "blue": "#3b82f6",
    "red": "#ef4444",
    "green": "#22c55e",
    "purple": "#8b5cf6",
    "orange": "#f97316"
  },
  "labels": {
    "primary": "#18181b",
    "secondary": "#71717a",
    "tertiary": "#a1a1aa",
    "quaternary": "#d4d4d8"
  },
  "backgrounds": {
    "primary": "#fafafa",
    "secondary": "#f4f4f5",
    "tertiary": "#ffffff"
  },
  "fills": {
    "primary": "rgba(24, 24, 27, 0.08)",
    "secondary": "rgba(24, 24, 27, 0.06)",
    "tertiary": "rgba(24, 24, 27, 0.04)",
    "quaternary": "rgba(24, 24, 27, 0.02)"
  },
  "radius": {
    "xs": "4px",
    "sm": "8px",
    "md": "10px",
    "lg": "14px",
    "xl": "18px"
  },
  "shadows": {
    "sm": "0 1px 2px rgba(0, 0, 0, 0.05)",
    "md": "0 2px 8px rgba(0, 0, 0, 0.06), 0 1px 2px rgba(0, 0, 0, 0.04)",
    "lg": "0 4px 16px rgba(0, 0, 0, 0.08), 0 1px 3px rgba(0, 0, 0, 0.04)"
  },
  "typography": {
    "body": "'Plus Jakarta Sans', 'Inter', -apple-system, system-ui, sans-serif",
    "heading": "'Plus Jakarta Sans', 'Inter', -apple-system, system-ui, sans-serif"
  },
  "spatialMetaphor": "flat",
  "focusRing": "#3b82f6"
}
